paper_display_name,normalized_name,method_key_or_keys,class: internal_frontier | external_near_direct | external_adjacent | search_adapter | unknown,main_paper_baseline,appears_in_paper_table,supported_by_code,per_case_outputs_found,per_case_output_paths,answer_column_names,correctness_column_names,row_count,has_example_id,overlaps_300case_pal_run,overlap_count_if_known,action_trace_available,final_branch_states_available,notes
L1-MAX,l1_max,external_l1_max,external_near_direct,yes,yes,yes,yes,outputs/cohere_paired_pal_retry_vs_external_l1_300case_20260506T194114Z/external_l1_results.csv|outputs/cohere_paired_pal_retry_vs_external_l1_300case_20260506T194114Z/external_l1_results.jsonl|outputs/cohere_paired_pal_retry_vs_external_l1_300case_20260506T194114Z/paired_casebook.csv,external_l1_results: final_answer_raw/final_answer_canonical; paired_casebook: external_final_answer,external_l1_results: exact_match; paired_casebook: external_exact,300,yes,yes,300,no,no,Only external-paper baseline materially present in current 300-case Cohere paired artifact.
L1-EXACT,l1_exact,external_l1_exact,external_near_direct,yes,yes,yes,no,,,,,no,no,0,no,no,Registered in strategy builder but no local per-case run artifacts found.
TALE,tale,external_tale_prompt_budgeting,external_near_direct,yes,yes,yes,no,,,,,no,no,0,no,no,Docs/configs exist; no local per-case outputs for this method key found in outputs scan.
S1,s1,external_s1_budget_forcing,external_near_direct,yes,yes,yes,no,,,,,no,no,0,no,no,Docs/configs exist; no local per-case outputs for this method key found in outputs scan.
ZHAI-CPO-A,zhai_cpo_a,external_zhai_cpo_mode_a,external_adjacent,no,yes,yes,no,,,,,no,no,0,no,no,Implemented as adaptive/constrained-policy style comparator hook; not found in current local per-case artifacts.
BEST-ROUTE,best_route,best_route_official_import_v1 (config/import lane),external_adjacent,no,no,yes,no,,,,,no,no,0,no,no,Import/adjacent lane documented; no per-case baseline outputs detected in current scan.
When Solve / Verify,when_solve_when_verify,when_solve_when_verify_official_import_v1 (config/import lane),external_adjacent,no,no,yes,no,,,,,no,no,0,no,no,Adjacent import-validated baseline family in docs; no local per-case outputs found.
ReST-MCTS*,rest_mcts,rest_mcts_adjacent_comparison_contract_v2 / verify_rest_mcts_import,external_adjacent,no,no,yes,no,,,,,no,no,0,no,no,Adjacent contract lane documented; no local per-case ReST-MCTS baseline result CSV/JSONL found in this cleanup pass.
Tree-of-Thoughts-style adapters,tot_style_adapters,tot_bfs_matched_budget|tot_beam_matched_budget|tot_dfs_matched_budget,search_adapter,no,no,yes,no,,,,,no,no,0,no,no,Controllers exist in frontier registry; not exposed in current 300-case run script METHODS and no per-case outputs found.
