dataset_name,status,source_location,task_type,exact_answer_supported,multiple_choice_supported,code_execution_supported,multimodal,automatic_grading_supported,repository_loader_added,config_added,evaluation_ready,reason_if_partial_or_missing,notes
AIME 2025,added,https://huggingface.co/datasets/MathArena/aime_2025,exact_answer_math,true,false,false,false,true,true,true,true,,Integrated as MathArena/aime_2025 with aliases and ambiguity tags; schema matches existing exact-answer math path.
LiveCodeBench,partially_added,https://huggingface.co/datasets/livecodebench/code_generation,code_generation_execution_backed,false,false,false,false,false,true,true,false,"Dataset loader/normalization added, but repository does not yet include execution sandbox + official testcase grader integration for fixed-budget evaluation.",Aliased livecodebench to livecodebench/code_generation; stored test-case metadata fields in normalized rows.
HMMT,added,https://huggingface.co/datasets/MathArena/hmmt_feb_2025,exact_answer_math,true,false,false,false,true,true,true,true,,Integrated as MathArena/hmmt_feb_2025 with hmmt alias and expansion-evaluation role tag.
BRUMO,added,https://huggingface.co/datasets/MathArena/brumo_2025,exact_answer_math,true,false,false,false,true,true,true,true,,Integrated as MathArena/brumo_2025 with brumo alias and expansion-evaluation role tag.
Humanity's Last Exam (HLE),not_added,https://huggingface.co/datasets/cais/hle,mixed_text_and_multimodal,unknown_without_access,unknown_without_access,false,true,unknown_without_access,false,false,false,"Access issue: canonical cais/hle dataset is gated in this environment, so no inspectable schema/splits were available for a safe text-only exact-answer integration in this pass.",Best next step is to obtain access and then wire text-only/auto-gradable subsets first.
MMLU-Pro,added,https://huggingface.co/datasets/TIGER-Lab/MMLU-Pro,multiple_choice,false,true,false,false,true,true,true,true,,Integrated as TIGER-Lab/MMLU-Pro with MCQ normalization (options answer_index category).
